{
  "schemaVersion": "mesh-reference-1.0",
  "taskId": "VF-022",
  "selectedCandidateId": "candidate_e",
  "candidateBoardPath": "Dogfooding/Evidence/VF-021-concepts-v2/candidate-e-cavalier-wall-board.png",
  "candidateBoardSha256": "89354ac5613efbf26603d32c4b8755559a4a53f2abad2a95e198d686b482392e",
  "modelSheetPath": "Dogfooding/Evidence/VF-022R-model-sheet/candidate-e-model-sheet-v2.png",
  "modelSheetSha256": "36b4b5ede3711d662ef83cee5446af0e9360c92893bdbc669a7b0aa7fbffad6f",
  "unityUnitsPerMeter": 1.0,
  "surfaceCenterDepthMeters": 0.42,
  "surfaceEdgeDepthMeters": 0.18,
  "frameThicknessMeters": 0.24,
  "views": [
    { "id": "front", "projection": "orthographic", "width": 627, "height": 627, "position": { "x": 0.0, "y": 2.0, "z": -10.0 }, "target": { "x": 0.0, "y": 2.0, "z": 0.0 }, "rotationEuler": { "x": 0.0, "y": 0.0, "z": 0.0 }, "fieldOfView": 0.0, "orthographicSize": 3.2, "normalizedImageRect": { "x": 0.0, "y": 0.5, "width": 0.5, "height": 0.5 } },
    { "id": "top", "projection": "orthographic", "width": 627, "height": 627, "position": { "x": 0.0, "y": 12.0, "z": 0.0 }, "target": { "x": 0.0, "y": 2.0, "z": 0.0 }, "rotationEuler": { "x": 90.0, "y": 0.0, "z": 0.0 }, "fieldOfView": 0.0, "orthographicSize": 3.2, "normalizedImageRect": { "x": 0.5, "y": 0.5, "width": 0.5, "height": 0.5 } },
    { "id": "right_side", "projection": "orthographic", "width": 627, "height": 627, "position": { "x": 10.0, "y": 2.0, "z": 0.0 }, "target": { "x": 0.0, "y": 2.0, "z": 0.0 }, "rotationEuler": { "x": 0.0, "y": -90.0, "z": 0.0 }, "fieldOfView": 0.0, "orthographicSize": 3.2, "normalizedImageRect": { "x": 0.0, "y": 0.0, "width": 0.5, "height": 0.5 } },
    { "id": "gameplay", "projection": "perspective", "width": 627, "height": 627, "position": { "x": 7.0, "y": 8.0, "z": -8.0 }, "target": { "x": 0.0, "y": 2.0, "z": 0.0 }, "rotationEuler": { "x": 29.44, "y": -41.19, "z": 0.0 }, "fieldOfView": 42.0, "orthographicSize": 0.0, "normalizedImageRect": { "x": 0.5, "y": 0.0, "width": 0.5, "height": 0.5 } }
  ],
  "landmarks": [
    { "id": "front_surface_center", "viewId": "front", "partId": "surface", "normalizedPosition": { "x": 0.50, "y": 0.51 }, "depthMeters": 0.42 },
    { "id": "front_frame_apex", "viewId": "front", "partId": "frame", "normalizedPosition": { "x": 0.32, "y": 0.79 }, "depthMeters": 0.18 },
    { "id": "front_frame_lower_return", "viewId": "front", "partId": "frame", "normalizedPosition": { "x": 0.55, "y": 0.25 }, "depthMeters": 0.18 },
    { "id": "front_anchor_left", "viewId": "front", "partId": "anchor_front_left", "normalizedPosition": { "x": 0.15, "y": 0.82 }, "depthMeters": 0.24 },
    { "id": "front_anchor_right", "viewId": "front", "partId": "anchor_front_right", "normalizedPosition": { "x": 0.86, "y": 0.45 }, "depthMeters": 0.26 },
    { "id": "front_root_left", "viewId": "front", "partId": "anchor_root_left", "normalizedPosition": { "x": 0.25, "y": 0.30 }, "depthMeters": 0.38 },
    { "id": "front_root_right", "viewId": "front", "partId": "anchor_root_right", "normalizedPosition": { "x": 0.84, "y": 0.21 }, "depthMeters": 0.44 },
    { "id": "top_surface_center", "viewId": "top", "partId": "surface", "normalizedPosition": { "x": 0.51, "y": 0.49 }, "depthMeters": 0.42 },
    { "id": "top_frame_center", "viewId": "top", "partId": "frame", "normalizedPosition": { "x": 0.50, "y": 0.53 }, "depthMeters": 0.24 },
    { "id": "top_anchor_left", "viewId": "top", "partId": "anchor_front_left", "normalizedPosition": { "x": 0.08, "y": 0.51 }, "depthMeters": 0.32 },
    { "id": "top_anchor_right", "viewId": "top", "partId": "anchor_front_right", "normalizedPosition": { "x": 0.64, "y": 0.50 }, "depthMeters": 0.30 },
    { "id": "top_root_left", "viewId": "top", "partId": "anchor_root_left", "normalizedPosition": { "x": 0.19, "y": 0.46 }, "depthMeters": 0.40 },
    { "id": "top_root_right", "viewId": "top", "partId": "anchor_root_right", "normalizedPosition": { "x": 0.91, "y": 0.49 }, "depthMeters": 0.48 },
    { "id": "side_surface_center", "viewId": "right_side", "partId": "surface", "normalizedPosition": { "x": 0.50, "y": 0.52 }, "depthMeters": 0.42 },
    { "id": "side_frame_center", "viewId": "right_side", "partId": "frame", "normalizedPosition": { "x": 0.50, "y": 0.60 }, "depthMeters": 0.24 },
    { "id": "side_anchor_left", "viewId": "right_side", "partId": "anchor_front_left", "normalizedPosition": { "x": 0.50, "y": 0.88 }, "depthMeters": 0.32 },
    { "id": "side_anchor_right", "viewId": "right_side", "partId": "anchor_front_right", "normalizedPosition": { "x": 0.50, "y": 0.76 }, "depthMeters": 0.30 },
    { "id": "side_root_left", "viewId": "right_side", "partId": "anchor_root_left", "normalizedPosition": { "x": 0.50, "y": 0.29 }, "depthMeters": 0.40 },
    { "id": "side_root_right", "viewId": "right_side", "partId": "anchor_root_right", "normalizedPosition": { "x": 0.50, "y": 0.16 }, "depthMeters": 0.48 },
    { "id": "gameplay_surface_center", "viewId": "gameplay", "partId": "surface", "normalizedPosition": { "x": 0.54, "y": 0.50 }, "depthMeters": 0.42 },
    { "id": "gameplay_frame_apex", "viewId": "gameplay", "partId": "frame", "normalizedPosition": { "x": 0.37, "y": 0.80 }, "depthMeters": 0.18 },
    { "id": "gameplay_anchor_left", "viewId": "gameplay", "partId": "anchor_front_left", "normalizedPosition": { "x": 0.16, "y": 0.83 }, "depthMeters": 0.32 },
    { "id": "gameplay_anchor_right", "viewId": "gameplay", "partId": "anchor_front_right", "normalizedPosition": { "x": 0.84, "y": 0.45 }, "depthMeters": 0.30 },
    { "id": "gameplay_root_left", "viewId": "gameplay", "partId": "anchor_root_left", "normalizedPosition": { "x": 0.25, "y": 0.27 }, "depthMeters": 0.40 },
    { "id": "gameplay_root_right", "viewId": "gameplay", "partId": "anchor_root_right", "normalizedPosition": { "x": 0.82, "y": 0.18 }, "depthMeters": 0.48 }
  ],
  "parts": [
    { "id": "surface", "role": "slanted_wedge_energy_plate", "materialZone": "surface", "connectedTo": ["frame"] },
    { "id": "frame", "role": "directional_structural_frame_with_shoulder_joint", "materialZone": "frame", "connectedTo": ["surface", "anchor_front_left", "anchor_front_right", "anchor_root_left", "anchor_root_right"] },
    { "id": "anchor_front_left", "role": "upper_left_cap", "materialZone": "anchor", "connectedTo": ["frame"] },
    { "id": "anchor_front_right", "role": "enemy_side_frame_clamp", "materialZone": "anchor", "connectedTo": ["frame"] },
    { "id": "anchor_root_left", "role": "raised_caster_side_root", "materialZone": "anchor", "connectedTo": ["frame"] },
    { "id": "anchor_root_right", "role": "heavy_lower_enemy_side_footing", "materialZone": "anchor", "connectedTo": ["frame"] }
  ]
}
