{
  "schemaVersion": "mesh-reference-1.0",
  "taskId": "VF-022",
  "selectedCandidateId": "candidate_e_symmetric_shield",
  "candidateBoardPath": "Dogfooding/Evidence/VF-021-concepts-v2/candidate-e-cavalier-wall-board.png",
  "candidateBoardSha256": "89354ac5613efbf26603d32c4b8755559a4a53f2abad2a95e198d686b482392e",
  "modelSheetPath": "Dogfooding/Evidence/VF-022R-model-sheet/candidate-e-model-sheet-v3.png",
  "modelSheetSha256": "ff61ba884c8a94252ccb4a3eecbdc451668dd612f86936ae82a19609f4a36173",
  "unityUnitsPerMeter": 1.0,
  "surfaceCenterDepthMeters": 0.48,
  "surfaceEdgeDepthMeters": 0.20,
  "frameThicknessMeters": 0.28,
  "views": [
    { "id": "front", "projection": "orthographic", "width": 627, "height": 627, "position": { "x": 0.0, "y": 2.7, "z": -10.0 }, "target": { "x": 0.0, "y": 2.7, "z": 0.0 }, "rotationEuler": { "x": 0.0, "y": 0.0, "z": 0.0 }, "fieldOfView": 0.0, "orthographicSize": 3.6, "normalizedImageRect": { "x": 0.0, "y": 0.5, "width": 0.5, "height": 0.5 } },
    { "id": "top", "projection": "orthographic", "width": 627, "height": 627, "position": { "x": 0.0, "y": 12.7, "z": 0.0 }, "target": { "x": 0.0, "y": 2.7, "z": 0.0 }, "rotationEuler": { "x": 90.0, "y": 0.0, "z": 0.0 }, "fieldOfView": 0.0, "orthographicSize": 3.6, "normalizedImageRect": { "x": 0.5, "y": 0.5, "width": 0.5, "height": 0.5 } },
    { "id": "right_side", "projection": "orthographic", "width": 627, "height": 627, "position": { "x": 10.0, "y": 2.7, "z": 0.0 }, "target": { "x": 0.0, "y": 2.7, "z": 0.0 }, "rotationEuler": { "x": 0.0, "y": -90.0, "z": 0.0 }, "fieldOfView": 0.0, "orthographicSize": 3.6, "normalizedImageRect": { "x": 0.0, "y": 0.0, "width": 0.5, "height": 0.5 } },
    { "id": "gameplay", "projection": "perspective", "width": 627, "height": 627, "position": { "x": 7.0, "y": 8.7, "z": -8.0 }, "target": { "x": 0.0, "y": 2.7, "z": 0.0 }, "rotationEuler": { "x": 29.44, "y": -41.19, "z": 0.0 }, "fieldOfView": 42.0, "orthographicSize": 0.0, "normalizedImageRect": { "x": 0.5, "y": 0.0, "width": 0.5, "height": 0.5 } }
  ],
  "landmarks": [
    { "id": "front_surface_center", "viewId": "front", "partId": "surface", "normalizedPosition": { "x": 0.50, "y": 0.52 }, "depthMeters": 0.48 },
    { "id": "front_frame_crown", "viewId": "front", "partId": "frame", "normalizedPosition": { "x": 0.50, "y": 0.91 }, "depthMeters": 0.20 },
    { "id": "front_frame_keel", "viewId": "front", "partId": "frame", "normalizedPosition": { "x": 0.50, "y": 0.08 }, "depthMeters": 0.20 },
    { "id": "front_upper_left", "viewId": "front", "partId": "anchor_front_left", "normalizedPosition": { "x": 0.18, "y": 0.73 }, "depthMeters": 0.32 },
    { "id": "front_upper_right", "viewId": "front", "partId": "anchor_front_right", "normalizedPosition": { "x": 0.82, "y": 0.73 }, "depthMeters": 0.32 },
    { "id": "front_lower_left", "viewId": "front", "partId": "anchor_root_left", "normalizedPosition": { "x": 0.25, "y": 0.31 }, "depthMeters": 0.34 },
    { "id": "front_lower_right", "viewId": "front", "partId": "anchor_root_right", "normalizedPosition": { "x": 0.75, "y": 0.31 }, "depthMeters": 0.34 },
    { "id": "top_surface_center", "viewId": "top", "partId": "surface", "normalizedPosition": { "x": 0.50, "y": 0.55 }, "depthMeters": 0.48 },
    { "id": "top_frame_center", "viewId": "top", "partId": "frame", "normalizedPosition": { "x": 0.50, "y": 0.42 }, "depthMeters": 0.28 },
    { "id": "top_upper_left", "viewId": "top", "partId": "anchor_front_left", "normalizedPosition": { "x": 0.16, "y": 0.54 }, "depthMeters": 0.34 },
    { "id": "top_upper_right", "viewId": "top", "partId": "anchor_front_right", "normalizedPosition": { "x": 0.84, "y": 0.54 }, "depthMeters": 0.34 },
    { "id": "top_lower_left", "viewId": "top", "partId": "anchor_root_left", "normalizedPosition": { "x": 0.21, "y": 0.43 }, "depthMeters": 0.36 },
    { "id": "top_lower_right", "viewId": "top", "partId": "anchor_root_right", "normalizedPosition": { "x": 0.79, "y": 0.43 }, "depthMeters": 0.36 },
    { "id": "side_surface_center", "viewId": "right_side", "partId": "surface", "normalizedPosition": { "x": 0.48, "y": 0.53 }, "depthMeters": 0.48 },
    { "id": "side_frame_center", "viewId": "right_side", "partId": "frame", "normalizedPosition": { "x": 0.52, "y": 0.57 }, "depthMeters": 0.28 },
    { "id": "side_upper_left", "viewId": "right_side", "partId": "anchor_front_left", "normalizedPosition": { "x": 0.50, "y": 0.79 }, "depthMeters": 0.34 },
    { "id": "side_upper_right", "viewId": "right_side", "partId": "anchor_front_right", "normalizedPosition": { "x": 0.50, "y": 0.73 }, "depthMeters": 0.34 },
    { "id": "side_lower_left", "viewId": "right_side", "partId": "anchor_root_left", "normalizedPosition": { "x": 0.50, "y": 0.31 }, "depthMeters": 0.36 },
    { "id": "side_lower_right", "viewId": "right_side", "partId": "anchor_root_right", "normalizedPosition": { "x": 0.50, "y": 0.24 }, "depthMeters": 0.36 },
    { "id": "gameplay_surface_center", "viewId": "gameplay", "partId": "surface", "normalizedPosition": { "x": 0.55, "y": 0.53 }, "depthMeters": 0.48 },
    { "id": "gameplay_frame_crown", "viewId": "gameplay", "partId": "frame", "normalizedPosition": { "x": 0.48, "y": 0.89 }, "depthMeters": 0.20 },
    { "id": "gameplay_upper_left", "viewId": "gameplay", "partId": "anchor_front_left", "normalizedPosition": { "x": 0.22, "y": 0.72 }, "depthMeters": 0.34 },
    { "id": "gameplay_upper_right", "viewId": "gameplay", "partId": "anchor_front_right", "normalizedPosition": { "x": 0.83, "y": 0.68 }, "depthMeters": 0.34 },
    { "id": "gameplay_lower_left", "viewId": "gameplay", "partId": "anchor_root_left", "normalizedPosition": { "x": 0.30, "y": 0.31 }, "depthMeters": 0.36 },
    { "id": "gameplay_lower_right", "viewId": "gameplay", "partId": "anchor_root_right", "normalizedPosition": { "x": 0.72, "y": 0.27 }, "depthMeters": 0.36 }
  ],
  "parts": [
    { "id": "surface", "role": "convex_symmetric_shield_plate", "materialZone": "surface", "connectedTo": ["frame"] },
    { "id": "frame", "role": "continuous_symmetric_shield_rim", "materialZone": "frame", "connectedTo": ["surface", "anchor_front_left", "anchor_front_right", "anchor_root_left", "anchor_root_right"] },
    { "id": "anchor_front_left", "role": "upper_left_shoulder_guard", "materialZone": "anchor", "connectedTo": ["frame"] },
    { "id": "anchor_front_right", "role": "upper_right_shoulder_guard", "materialZone": "anchor", "connectedTo": ["frame"] },
    { "id": "anchor_root_left", "role": "lower_left_flank_guard", "materialZone": "anchor", "connectedTo": ["frame"] },
    { "id": "anchor_root_right", "role": "lower_right_flank_guard", "materialZone": "anchor", "connectedTo": ["frame"] }
  ]
}
